{
  "schema_version": "research_case.v1",
  "case_id": "style-replica-evidence-gap",
  "question": "StyleReplica A80/B20 作为 operational_research 策略，其七项强制证据为何全部缺失，当前应如何登记判断？",
  "as_of": "2026-08-18",
  "research_specs": [
    "strategy-research/strategies/style_replica/README.md"
  ],
  "claims": [
    "style_replica.factor_semantics_owner_split"
  ],
  "evidence_bundles": [
    "strategy-research/evidence/style_replica_a80_b20.json"
  ],
  "reviews": [
    {
      "review_id": "style-replica-logic-r1",
      "kind": "logic",
      "status": "completed",
      "file": "reviews/logic.json"
    },
    {
      "review_id": "style-replica-evidence-r1",
      "kind": "evidence",
      "status": "completed",
      "file": "reviews/evidence.json"
    }
  ],
  "known_gaps": [
    "pit: 未提供时间点数据证据",
    "walk_forward: 未提供滚动样本外证据",
    "benchmark_matrix: 未提供统一考试表",
    "cost: 未提供交易成本证据",
    "final_oos: 未提供最终样本外或书面替代",
    "cpcv: 未提供组合对称交叉验证",
    "regime: 未提供市场状态分别报告"
  ],
  "abstentions": [
    {
      "dimension": "因子有效性",
      "reason": "七项强制证据全部 missing，未形成可验证的晋级证据。"
    }
  ],
  "decision": {
    "status": "no_view",
    "thesis": "StyleReplica A80/B20 的风格因子语义与组合语义职责拆分清晰，但 operational_research 要求的七项强制证据全部缺失。按缺数据即放弃判断的原则，因子有效性维度 abstain，保持 no_view。职责拆分成立不等于因子有效。"
  }
}
