{
  "schema_version": "research_case.v1",
  "case_id": "hotsector-pit-discipline",
  "question": "热点板块选股在未启用严格 PIT 约束的情况下，其排序能力证据是否可信？",
  "as_of": "2026-08-18",
  "research_specs": [
    "strategy-research/strategies/hotsector/README.md"
  ],
  "claims": [
    "hotsector.point_in_time_discipline"
  ],
  "evidence_bundles": [
    "strategy-research/evidence/hotsector.json",
    "strategy-app/docs/research/evidence/hotsector-numeric-v2-retrospective-receipt-20260717.json"
  ],
  "reviews": [
    {
      "review_id": "hotsector-logic-r1",
      "kind": "logic",
      "status": "completed",
      "file": "reviews/logic.json"
    },
    {
      "review_id": "hotsector-evidence-r1",
      "kind": "evidence",
      "status": "completed",
      "file": "reviews/evidence.json"
    }
  ],
  "known_gaps": [
    "pit: 回执 strict_point_in_time=false，未启用 PIT 时间点约束",
    "benchmark_matrix: 缺少跨维度统一考试表",
    "cost: 未记录多成本假设下的换手与收益",
    "final_oos: 无最终样本外或书面替代",
    "cpcv: 未做组合对称交叉验证",
    "regime: 未按市场状态分别报告表现"
  ],
  "abstentions": [
    {
      "dimension": "排序能力有效性",
      "reason": "strict_point_in_time=false，无法确认排序是否引入未来函数。"
    }
  ],
  "decision": {
    "status": "no_view",
    "thesis": "hotsector 的多臂回顾回执明确 strict_point_in_time=false，未启用 PIT 约束，且 cost、final_oos、cpcv、regime、benchmark_matrix 全部 pending。以当前证据不能判定排序能力是否可信，保持 no_view，禁止把非 PIT 回执当作晋级证据。"
  }
}
